{
  "id": "feed.mail.digest.2026-03-29",
  "ts": "2026-03-29T10:00:00Z",
  "feed_type": "digest",
  "title": "Mail cleanup digest",
  "summary": "22 promo emails archived and 6 held for review.",
  "scope": "private",
  "source": "spool:mail",
  "tags": [
    "mail",
    "digest"
  ],
  "refs": [
    "binder:mail",
    "event:evt.mail.cleanup.2026-03-29T09:10:00Z"
  ],
  "data": {
    "group_by": "day"
  }
}
